{
  "schema_version": "authoritative-dynamic-set-v0.1",
  "set_id": "gar:harmonised-standard-references",
  "set_character": "AUTHORITATIVE_DYNAMIC_SET",
  "authority": {
    "authority_id": "EUROPEAN_COMMISSION",
    "label": "European Commission",
    "authority_type": "EU_INSTITUTION"
  },
  "publication_surface": {
    "surface_type": "OFFICIAL_JOURNAL",
    "identifier": "Official Journal references of harmonised standards supporting Regulation (EU) 2016/426",
    "authenticity_basis": "Regulation (EU) 2016/426 Article 13 makes publication of a harmonised-standard reference in the Official Journal the condition for presumption of conformity with covered essential requirements.",
    "source_ref": {
      "source_type": "EUR_LEX",
      "identifier": "CELEX:32016R0426",
      "locator": "Article 13",
      "language": "ENG",
      "role": "LEGAL_BASIS",
      "authority_character": "BINDING_LEGAL_TEXT"
    }
  },
  "legal_basis_refs": [
    {
      "source_type": "EUR_LEX",
      "identifier": "CELEX:32016R0426",
      "locator": "Article 13",
      "language": "ENG",
      "role": "LEGAL_BASIS",
      "authority_character": "BINDING_LEGAL_TEXT"
    },
    {
      "source_type": "EUR_LEX",
      "identifier": "CELEX:32026D1750",
      "locator": "Article 1 and Article 2",
      "language": "ENG",
      "role": "TRANSITION",
      "authority_character": "BINDING_LEGAL_TEXT"
    }
  ],
  "dependencies": [
    {
      "dependency_id": "gar-art13-on-harmonised-reference-set",
      "governing_rule": {
        "act_id": "CELEX:32016R0426",
        "provision": "Article 13",
        "language": "ENG"
      },
      "relation_character": "LEGAL_EFFECT_CONDITIONED_ON_AUTHORITATIVE_SET_STATE",
      "condition_statement": "Presumption of conformity under Regulation (EU) 2016/426 Article 13 depends on conformity with harmonised standards or parts whose references have been published in the Official Journal.",
      "evidence_state": "DIRECT",
      "source_refs": [
        {
          "source_type": "EUR_LEX",
          "identifier": "CELEX:32016R0426",
          "locator": "Article 13",
          "language": "ENG",
          "role": "DEPENDENCY",
          "authority_character": "BINDING_LEGAL_TEXT"
        }
      ]
    }
  ],
  "transitions": [
    {
      "transition_id": "gar-en497-formal-nonpublication-2026-07-24",
      "member": {
        "label": "EN 497:2022",
        "identifiers": [
          {
            "scheme": "HARMONISED_STANDARD",
            "value": "EN 497:2022"
          }
        ]
      },
      "operation": "STATUS_CHANGE",
      "effective_from": "2026-07-24",
      "before": {
        "membership": "NOT_INCLUDED",
        "status": "NOT_APPLICABLE"
      },
      "after": {
        "membership": "NOT_INCLUDED",
        "status": "OTHER"
      },
      "scope": {
        "character": "FULL_MEMBER",
        "statement": "Commission Implementing Decision (EU) 2026/1750 formally decides not to publish the reference of EN 497:2022 in the Official Journal. EN 497:2022 therefore does not acquire Article 13 presumption-of-conformity status through OJ citation."
      },
      "evidence_state": "DIRECT",
      "source_refs": [
        {
          "source_type": "EUR_LEX",
          "identifier": "CELEX:32026D1750",
          "locator": "Article 1 — decision not to publish the reference to EN 497:2022",
          "language": "ENG",
          "role": "TRANSITION",
          "authority_character": "BINDING_LEGAL_TEXT"
        },
        {
          "source_type": "EUR_LEX",
          "identifier": "CELEX:32026D1750",
          "locator": "Article 2 — entry into force on the third day following OJ publication on 21 July 2026",
          "language": "ENG",
          "role": "SCOPE",
          "authority_character": "BINDING_LEGAL_TEXT"
        }
      ]
    }
  ],
  "forbidden_inferences": [
    "Publication or adoption of EN 497:2022 by a standards organisation by itself gives presumption of conformity under Regulation (EU) 2016/426.",
    "A standard that is not cited in the Official Journal is legally equivalent to a cited harmonised standard under Article 13.",
    "Commission Implementing Decision (EU) 2026/1750 is a textual mutation of Regulation (EU) 2016/426 Article 13.",
    "Lack of Article 13 presumption of conformity means the standard is forbidden or that no alternative conformity route exists.",
    "The formal non-publication decision may be collapsed into generic non-legal metadata."
  ],
  "notes": "Third orthogonal Authoritative Dynamic Set regression for Candidate B. It tests formal prevention/non-publication of an OJ harmonised-standard reference rather than restriction of an already cited reference or addition to an agency list."
}
